{
  "$schema": "https://json-schema.org/draft/2020-12/schema",
  "$id": "https://access-computer.local/schemas/remote_sensing_access.input.schema.json",
  "title": "RemoteSensingAccessInput",
  "type": "object",
  "required": ["task", "spacecraft", "target", "constraints"],
  "properties": {
    "request_id": { "type": "string" },
    "idempotency_key": { "type": "string" },
    "experimental": {
      "type": "object",
      "properties": {
        "allow_sar": {
          "type": "boolean",
          "description": "Reserved for SAR contract testing only; SAR planning is not implemented in v0.1.0"
        }
      },
      "additionalProperties": false
    },
    "task": {
      "type": "object",
      "required": [
        "scenario",
        "start_time_utc",
        "compute_horizon_sec",
        "working_time_sec",
        "step_sec"
      ],
      "properties": {
        "scenario": {
          "type": "string",
          "enum": [
            "remote_sensing_access",
            "attitude_estimation",
            "downlink_window"
          ]
        },
        "start_time_utc": {
          "type": "string",
          "description": "ISO-8601 UTC task computation start epoch"
        },
        "compute_horizon_sec": {
          "type": "number",
          "minimum": 1,
          "description": "Extrapolation horizon H from start_time_utc: compute over [start, start+H]"
        },
        "working_time_sec": {
          "type": "number",
          "minimum": 1,
          "description": "Detection working window W; final access is [t0-W/2, t0+W/2] for RSA/AE (not applied to downlink)"
        },
        "step_sec": { "type": "number", "minimum": 0.1 }
      },
      "additionalProperties": false
    },
    "spacecraft": {
      "type": "object",
      "required": ["sat_id", "epoch_utc", "state_type", "elements"],
      "properties": {
        "sat_id": { "type": "string" },
        "epoch_utc": {
          "type": "string",
          "description": "Orbit reference epoch for propagation (GMAT UTCGregorian), e.g. 30 Dec 2026 00:00:00.000"
        },
        "state_type": { "type": "string", "enum": ["keplerian"] },
        "elements": {
          "type": "object",
          "required": ["sma_km", "ecc", "inc_deg", "raan_deg", "aop_deg", "ta_deg"],
          "properties": {
            "sma_km": { "type": "number" },
            "ecc": { "type": "number" },
            "inc_deg": { "type": "number" },
            "raan_deg": { "type": "number" },
            "aop_deg": { "type": "number" },
            "ta_deg": { "type": "number" }
          }
        },
        "propagation_profile": {
          "type": "string",
          "enum": ["sso_j2_default", "segmented_drag_profile"],
          "description": "Only sso_j2_default is implemented in v0.1.0; segmented_drag_profile is reserved for future per-orbit drag/attitude segments"
        }
      }
    },
    "target": {
      "type": "object",
      "required": ["type", "lon_deg", "lat_deg", "alt_km"],
      "properties": {
        "type": { "type": "string", "enum": ["ground_point", "ground_station"] },
        "lon_deg": { "type": "number", "minimum": -180, "maximum": 180 },
        "lat_deg": { "type": "number", "minimum": -90, "maximum": 90 },
        "alt_km": { "type": "number" }
      }
    },
    "sensor": {
      "type": "object",
      "properties": {
        "type": {
          "type": "string",
          "enum": ["sar", "optical_linescan", "optical_area_array", "downlink_cone"]
        },
        "mode": { "type": "string", "enum": ["side_roll_only", "stare"] }
      }
    },
    "constraints": {
      "type": "object",
      "properties": {
        "roll_max_deg": {
          "type": "number",
          "minimum": 0,
          "maximum": 90,
          "description": "Side-roll limit theta_max; default 30 deg for optical access"
        },
        "require_sunlit": {
          "type": "boolean",
          "description": "Optical: require target sunlit (lit); default true when omitted for RSA optical (warning). Ignored for SAR/DL with warning."
        },
        "exclude_umbra": {
          "type": "boolean",
          "description": "Optical: exclude Umbra when eclipse report available (default true). Best-effort skip+warning if report missing. Ignored for SAR/DL."
        },
        "exclude_penumbra": {
          "type": "boolean",
          "description": "Optical: exclude Penumbra and Antumbra when eclipse report available (default false). Best-effort skip+warning if report missing. Ignored for SAR/DL."
        },
        "cone_angle_deg": {
          "type": "number",
          "minimum": 0,
          "maximum": 90,
          "description": "Ground-station cone half-angle from zenith for downlink visibility; default 80 deg (MinimumElevationAngle = 90 - cone = 10 deg ESA baseline); explicit values remain supported"
        }
      },
      "additionalProperties": false
    },
    "gmat": {
      "type": "object",
      "properties": {
        "install_root": { "type": "string" },
        "console_binary": { "type": "string" }
      }
    }
  },
  "additionalProperties": false
}
