{
  "request_id": "req_downlink_001",
  "task": {
    "scenario": "downlink_window",
    "start_time_utc": "2026-12-30T03:00:00Z",
    "compute_horizon_sec": 7200,
    "working_time_sec": 7200,
    "step_sec": 5
  },
  "spacecraft": {
    "sat_id": "sat_A",
    "epoch_utc": "30 Dec 2026 00:00:00.000",
    "state_type": "keplerian",
    "elements": {
      "sma_km": 6716.14,
      "ecc": 0.0,
      "inc_deg": 96.806,
      "raan_deg": 76.515,
      "aop_deg": 0.0,
      "ta_deg": 0.0
    },
    "propagation_profile": "sso_j2_default"
  },
  "target": {
    "type": "ground_station",
    "lon_deg": 114.3055,
    "lat_deg": 30.5928,
    "alt_km": 0.057
  },
  "sensor": {
    "type": "downlink_cone"
  },
  "constraints": {},
  "gmat": {
    "install_root": "/home/hotdry/projects/GMAT-R2026a/GMAT-R2026a-Linux-x64"
  }
}
